{"clauses":["STD-LGS-021"],"description":"qualifiers of every kind add up","id":"VER-CONF-4979","polarity":"positive","profile":"Governance","setup":[],"steps":[{"expect":{"match":"exact","result":{"specificity":[3,1,2,1]}},"input":{"classes":[{"description":"Account","fields":[{"description":"name","label":"name","name":"name","required":true,"type":"text"},{"description":"kind","label":"kind","name":"kind","type":"text"}],"kind":"definition","label":"Account","name":"Account","namespace":"acme.finance","parent":"DataObject","schema_version":1},{"description":"Party","fields":[{"description":"name","label":"name","name":"name","required":true,"type":"text"},{"default":"US","description":"country","label":"country","name":"country","type":"text"},{"constraints":{"item_type":{"type":"text"}},"description":"tags","label":"tags","name":"tags","type":"list"},{"constraints":{"allowed_values":["draft","active","closed"]},"description":"state","label":"state","name":"state","type":"enum"}],"kind":"definition","label":"Party","name":"Party","namespace":"acme.finance","parent":"DataObject","schema_version":1},{"description":"Customer","fields":[{"description":"email","label":"email","name":"email","type":"text"},{"description":"credit_limit","label":"credit limit","name":"credit_limit","type":"money"},{"constraints":{"target_class":"Account"},"description":"account","label":"account","name":"account","type":"reference"}],"kind":"definition","label":"Customer","name":"Customer","namespace":"acme.finance","parent":"Party","schema_version":1},{"description":"VipCustomer","fields":[{"description":"manager","label":"manager","name":"manager","type":"text"}],"kind":"definition","label":"VipCustomer","name":"VipCustomer","namespace":"acme.finance","parent":"Customer","schema_version":1,"traits":["Tagged"]},{"description":"Supplier","fields":[{"description":"rating","label":"rating","name":"rating","type":"integer"}],"kind":"definition","label":"Supplier","name":"Supplier","namespace":"acme.finance","parent":"Party","schema_version":1},{"description":"ScannedForm","fields":[{"description":"source","label":"source","name":"source","required":true,"type":"text"}],"kind":"raw_document","label":"ScannedForm","name":"ScannedForm","namespace":"acme.finance","parent":"DataObject","schema_version":1},{"applies_to":["definition"],"description":"Tagged","fields":[],"label":"Tagged","name":"Tagged","namespace":"acme.finance","schema_version":1,"trait":true}],"selector":"Customer[this.country == \"US\"]:active:tag(vip):ctx(role = \"cfo\")"},"op":"specificity"}]}
