{"clauses":["STD-FND-028"],"description":"the table gives the minor units of ISO 4217 codes","id":"VER-CONF-0280","polarity":"positive","profile":"Core","setup":[{"input":{"now":"2026-03-15T10:00:00.000000Z"},"op":"set_now"},{"input":{"classes":[{"description":"Customer","fields":[{"description":"name","label":"name","name":"name","required":true,"type":"text"},{"description":"email","label":"email","name":"email","type":"text"},{"description":"credit_limit","label":"credit limit","name":"credit_limit","type":"money"},{"default":"US","description":"country","label":"country","name":"country","type":"text"}],"kind":"definition","label":"Customer","name":"Customer","namespace":"acme.finance","parent":"DataObject","schema_version":1},{"description":"FiscalPeriod","fields":[{"description":"start","label":"start","name":"start","required":true,"type":"date"},{"description":"end","label":"end","name":"end","required":true,"type":"date"},{"constraints":{"allowed_values":["open","closing","closed"]},"description":"state","label":"state","name":"state","required":true,"type":"enum"}],"kind":"definition","label":"FiscalPeriod","name":"FiscalPeriod","namespace":"acme.finance","parent":"DataObject","schema_version":1},{"description":"GlEntry","fields":[{"description":"account","label":"account","name":"account","required":true,"type":"text"},{"description":"amount","label":"amount","name":"amount","required":true,"type":"money"},{"description":"memo","label":"memo","name":"memo","type":"text"}],"kind":"ledger","label":"GlEntry","ledger":{"amounts":["amount"],"double_entry":true,"key":["account"],"period_scope":"FiscalPeriod"},"name":"GlEntry","namespace":"acme.finance","parent":"DataObject","schema_version":1},{"description":"StockMove","fields":[{"description":"item","label":"item","name":"item","required":true,"type":"text"},{"description":"quantity","label":"quantity","name":"quantity","required":true,"type":"decimal"}],"kind":"ledger","label":"StockMove","ledger":{"amounts":["quantity"],"double_entry":false,"key":["item"]},"name":"StockMove","namespace":"acme.finance","parent":"DataObject","schema_version":1},{"description":"ImportedDocument","fields":[{"description":"source","label":"source","name":"source","required":true,"type":"text"}],"kind":"raw_document","label":"ImportedDocument","name":"ImportedDocument","namespace":"acme.finance","parent":"DataObject","schema_version":1},{"description":"DeliveryJob","fields":[{"description":"target","label":"target","name":"target","type":"text"}],"kind":"system","label":"DeliveryJob","name":"DeliveryJob","namespace":"acme.finance","parent":"SystemObject","schema_version":1},{"description":"Posting","fields":[{"constraints":{"target_class":"LedgerAccount"},"description":"account","label":"account","name":"account","required":true,"type":"reference"},{"description":"amount","label":"amount","name":"amount","required":true,"type":"money"},{"description":"memo","label":"memo","name":"memo","type":"text"}],"kind":"ledger","label":"Posting","ledger":{"account":"account","amounts":["amount"],"double_entry":true,"key":["account"]},"name":"Posting","namespace":"acme.finance","parent":"DataObject","schema_version":1},{"description":"BankStatementLine","fields":[{"description":"source","label":"source","name":"source","required":true,"type":"text"},{"description":"bank_account","label":"bank account","name":"bank_account","required":true,"type":"text"},{"description":"statement","label":"statement","name":"statement","required":true,"type":"text"},{"description":"line","label":"line","name":"line","required":true,"type":"integer"},{"description":"amount","label":"amount","name":"amount","required":true,"type":"money"},{"description":"reference","label":"reference","name":"reference","type":"text"}],"kind":"ledger","label":"BankStatementLine","ledger":{"amounts":["amount"],"double_entry":false,"key":["bank_account"],"statement":{"account":"bank_account","line":"line","source":"source","statement":"statement"}},"name":"BankStatementLine","namespace":"acme.finance","parent":"DataObject","schema_version":1}]},"op":"load_genesis"}],"steps":[{"expect":{"match":"subset","result":{"code":"JPY","minor_units":0,"source":"table"}},"input":{"branch":"main","code":"JPY"},"op":"currency"},{"expect":{"match":"subset","result":{"code":"OMR","minor_units":3,"source":"table"}},"input":{"branch":"main","code":"OMR"},"op":"currency"},{"expect":{"match":"subset","result":{"code":"MXN","minor_units":2,"source":"table"}},"input":{"branch":"main","code":"MXN"},"op":"currency"},{"expect":{"match":"subset","result":{"code":"CLF","minor_units":4,"source":"table"}},"input":{"branch":"main","code":"CLF"},"op":"currency"}]}
