{"clauses":["STD-EXPR-002"],"description":"a condition is boolean","id":"VER-CONF-4475","polarity":"negative","profile":"Core","setup":[],"steps":[{"expect":{"error_code":"LOGIC.TYPE_ERROR"},"input":{"class":"Invoice","classes":[{"description":"Invoice","fields":[{"description":"number","label":"number","name":"number","required":true,"type":"text"},{"description":"total","label":"total","name":"total","type":"money"},{"description":"due","label":"due","name":"due","type":"date"},{"constraints":{"allowed_values":["open","paid"]},"description":"status","label":"status","name":"status","type":"enum"},{"constraints":{"item_type":{"type":"decimal"}},"description":"lines","label":"lines","name":"lines","type":"list"},{"constraints":{"target_class":"Customer"},"description":"customer","label":"customer","name":"customer","type":"reference"},{"description":"note","label":"note","name":"note","type":"text"},{"description":"issued","label":"issued","name":"issued","type":"instant"}],"kind":"definition","label":"Invoice","name":"Invoice","namespace":"acme.finance","parent":"DataObject","schema_version":1},{"description":"Customer","fields":[{"description":"name","label":"name","name":"name","required":true,"type":"text"},{"description":"email","label":"email","name":"email","type":"text"},{"description":"credit_limit","label":"credit limit","name":"credit_limit","type":"money"},{"default":"US","description":"country","label":"country","name":"country","type":"text"}],"kind":"definition","label":"Customer","name":"Customer","namespace":"acme.finance","parent":"DataObject","schema_version":1},{"description":"FiscalPeriod","fields":[{"description":"start","label":"start","name":"start","required":true,"type":"date"},{"description":"end","label":"end","name":"end","required":true,"type":"date"},{"constraints":{"allowed_values":["open","closing","closed"]},"description":"state","label":"state","name":"state","required":true,"type":"enum"}],"kind":"definition","label":"FiscalPeriod","name":"FiscalPeriod","namespace":"acme.finance","parent":"DataObject","schema_version":1},{"description":"GlEntry","fields":[{"description":"account","label":"account","name":"account","required":true,"type":"text"},{"description":"amount","label":"amount","name":"amount","required":true,"type":"money"},{"description":"memo","label":"memo","name":"memo","type":"text"}],"kind":"ledger","label":"GlEntry","ledger":{"amounts":["amount"],"double_entry":true,"key":["account"],"period_scope":"FiscalPeriod"},"name":"GlEntry","namespace":"acme.finance","parent":"DataObject","schema_version":1},{"description":"StockMove","fields":[{"description":"item","label":"item","name":"item","required":true,"type":"text"},{"description":"quantity","label":"quantity","name":"quantity","required":true,"type":"decimal"}],"kind":"ledger","label":"StockMove","ledger":{"amounts":["quantity"],"double_entry":false,"key":["item"]},"name":"StockMove","namespace":"acme.finance","parent":"DataObject","schema_version":1},{"description":"ImportedDocument","fields":[{"description":"source","label":"source","name":"source","required":true,"type":"text"}],"kind":"raw_document","label":"ImportedDocument","name":"ImportedDocument","namespace":"acme.finance","parent":"DataObject","schema_version":1},{"description":"DeliveryJob","fields":[{"description":"target","label":"target","name":"target","type":"text"}],"kind":"system","label":"DeliveryJob","name":"DeliveryJob","namespace":"acme.finance","parent":"SystemObject","schema_version":1}],"expr":"this.number ? 1 : 2"},"op":"check_expr"}]}
