{"clauses":["STD-ISA-083"],"description":"a lagging index omits newer changes and says so","id":"VER-CONF-3675","polarity":"positive","profile":"Core","setup":[{"input":{"now":"2026-03-15T10:00:00.000000Z"},"op":"set_now"},{"input":{"classes":[{"description":"Person","fields":[{"description":"name","label":"name","name":"name","required":true,"type":"text"},{"description":"did","label":"did","name":"did","type":"text"},{"description":"region","label":"region","name":"region","type":"text"},{"constraints":{"target_class":"Person"},"description":"manager","label":"manager","name":"manager","type":"reference"}],"kind":"definition","label":"Person","name":"Person","namespace":"acme.finance","parent":"DataObject","principal_field":"did","schema_version":1},{"description":"Team","fields":[{"description":"name","label":"name","name":"name","required":true,"type":"text"},{"constraints":{"item_type":{"constraints":{"target_class":"Person"},"type":"reference"}},"description":"members","label":"members","name":"members","type":"list"}],"kind":"definition","label":"Team","name":"Team","namespace":"acme.finance","parent":"DataObject","schema_version":1},{"description":"Invoice","fields":[{"description":"number","label":"number","name":"number","required":true,"type":"text"},{"description":"region","label":"region","name":"region","type":"text"},{"description":"amount","label":"amount","name":"amount","type":"money"},{"description":"qty","label":"qty","name":"qty","type":"integer"},{"description":"rate","label":"rate","name":"rate","type":"decimal"},{"classification":"confidential","description":"margin","label":"margin","name":"margin","type":"decimal"},{"authz_relation":"owner","constraints":{"target_class":"Person"},"description":"owner","label":"owner","name":"owner","type":"reference"},{"description":"title","label":"title","name":"title","text_index":true,"type":"text"},{"classification":"confidential","description":"memo","label":"memo","name":"memo","text_index":true,"type":"text"}],"kind":"definition","label":"Invoice","name":"Invoice","namespace":"acme.finance","parent":"DataObject","ports":[{"description":"approve","impl":"acme.srch#approve","kind":"command","name":"approve","params":[],"permission":"approve"}],"schema_version":1,"views":[{"mode":"view","variants":[{"device":"phone","view":"ubos://acme/View/invoice-phone"},{"device":"phone","role":"auditor","view":"ubos://acme/View/invoice-audit-phone"},{"role":"auditor","view":"ubos://acme/View/invoice-audit"}],"view":"ubos://acme/View/invoice"},{"mode":"print","view":"ubos://acme/View/missing"}]},{"description":"CreditNote","fields":[{"description":"reason","label":"reason","name":"reason","type":"text"}],"kind":"definition","label":"CreditNote","name":"CreditNote","namespace":"acme.finance","parent":"Invoice","schema_version":1}]},"op":"load_genesis"},{"input":{"from":"main","name":"feature/search"},"op":"create_branch"},{"input":{"branch":"feature/search","changes":[{"body":{"did":"did:ubos:acme:01900000-0000-7000-8000-0000000000a1","name":"Alice","region":"east"},"class":"Person","object_id":"01890a5d-ac96-7001-8000-000000000001","op":"create","slug":"alice"},{"body":{"did":"did:ubos:acme:01900000-0000-7000-8000-0000000000a2","manager":"ubos://acme/Person/alice","name":"Bob","region":"west"},"class":"Person","object_id":"01890a5d-ac96-7002-8000-000000000002","op":"create","slug":"bob"},{"body":{"manager":"ubos://acme/Person/bob","name":"Carol","region":"west"},"class":"Person","object_id":"01890a5d-ac96-7003-8000-000000000003","op":"create","slug":"carol"},{"body":{"members":["ubos://acme/Person/alice","ubos://acme/Person/bob"],"name":"Ops"},"class":"Team","object_id":"01890a5d-ac96-7005-8000-000000000005","op":"create","slug":"ops"},{"body":{"amount":{"amount":"100.00","currency":"USD"},"margin":"0.2","memo":"Payment reminder sent","number":"INV-1","owner":"ubos://acme/Person/alice","qty":2,"rate":"1.5","region":"east","title":"Quarterly invoices for consulting services"},"class":"Invoice","object_id":"01890a5d-ac96-700b-8000-00000000000b","op":"create","slug":"i-1"},{"body":{"amount":{"amount":"50.50","currency":"USD"},"margin":"0.2","number":"INV-2","owner":"ubos://acme/Person/alice","qty":3,"rate":"2.25","region":"east","title":"Consulting retainer"},"class":"Invoice","object_id":"01890a5d-ac96-700c-8000-00000000000c","op":"create","slug":"i-2"},{"body":{"amount":{"amount":"80.00","currency":"EUR"},"margin":"0.2","number":"INV-3","owner":"ubos://acme/Person/bob","qty":5,"rate":"0.5","region":"west","title":"Hardware invoice"},"class":"Invoice","object_id":"01890a5d-ac96-700d-8000-00000000000d","op":"create","slug":"i-3"},{"body":{"amount":{"amount":"20.00","currency":"USD"},"margin":"0.2","number":"INV-4","owner":"ubos://acme/Person/bob","qty":1,"rate":"3","region":"west","title":"Service subscription renewal"},"class":"Invoice","object_id":"01890a5d-ac96-700e-8000-00000000000e","op":"create","slug":"i-4"},{"body":{"description":"invoice","layout":{"slug":"invoice"},"name":"acme.invoice"},"class":"View","object_id":"01890a5d-ac96-7029-8000-000000000029","op":"create","slug":"invoice"},{"body":{"description":"invoice-phone","layout":{"slug":"invoice-phone"},"name":"acme.invoice-phone"},"class":"View","object_id":"01890a5d-ac96-702a-8000-00000000002a","op":"create","slug":"invoice-phone"},{"body":{"description":"invoice-audit-phone","layout":{"slug":"invoice-audit-phone"},"name":"acme.invoice-audit-phone"},"class":"View","object_id":"01890a5d-ac96-702b-8000-00000000002b","op":"create","slug":"invoice-audit-phone"},{"body":{"description":"invoice-audit","layout":{"slug":"invoice-audit"},"name":"acme.invoice-audit"},"class":"View","object_id":"01890a5d-ac96-702c-8000-00000000002c","op":"create","slug":"invoice-audit"},{"body":{"abi":"1.0","capabilities":["search","read"],"exports":["agg","walk","find","approve"],"name":"acme.srch","profile":"standard","source":{"functions":{"agg":{"body":[{"args":{"aggregates":"params.a","convert":"params.c","group_by":"params.g","query":"params.q"},"as":"r","do":"search.aggregate"},{"return":"r"}],"params":["q","g","a","c"]},"approve":{"body":[{"return":"\"ok\""}],"params":[]},"find":{"body":[{"args":{"classes":"params.k","limit":"params.l","text":"params.t"},"as":"r","do":"search.text"},{"return":"r"}],"params":["t","k","l"]},"walk":{"body":[{"args":{"classes":"params.k","depth":"params.n","direction":"params.d","fields":"params.f","limit":"params.l","start":"params.s"},"as":"r","do":"search.traverse"},{"return":"r"}],"params":["s","f","d","n","k","l"]}}},"state":"committed","tier":"host"},"class":"Logic","object_id":"01890a5d-ac96-7050-8000-000000000050","op":"create","slug":"acme-srch"}]},"label":"d","op":"commit"}],"steps":[{"expect":{"match":"subset","result":{"branch":"feature/search","cseq":1}},"input":{"branch":"feature/search","cseq":1},"op":"index_lag"},{"expect":{"match":"subset","result":{"cseq":2,"entries":{},"retroactive":[]}},"input":{"branch":"feature/search","changes":[{"body":{"amount":{"amount":"5.00","currency":"USD"},"margin":"0.2","number":"INV-6","owner":"ubos://acme/Person/alice","qty":1,"rate":"1","region":"east","title":"Late invoice"},"class":"Invoice","object_id":"01890a5d-ac96-7010-8000-000000000010","op":"create","slug":"i-6"}]},"op":"commit"},{"expect":{"match":"subset","result":{"attempts":1,"metering":{"connector_calls":0,"instructions":{"search":1},"outcome":"ok","process_id":"00000000-0000-4000-8000-000000000003","units":41},"result":{"items":[{"class":"Invoice","field":"title","object_id":"01890a5d-ac96-700b-8000-00000000000b","score":[1,1],"snippet":"Quarterly <em>invoices</em> for consulting services"},{"class":"Invoice","field":"title","object_id":"01890a5d-ac96-700d-8000-00000000000d","score":[1,1],"snippet":"Hardware <em>invoice</em>"}],"lagging":true,"watermark":{"cseq":1}}}},"input":{"args":["invoice",null,null],"asset":"acme.srch","branch":"feature/search","entropy_seed":"1111111111111111111111111111111111111111111111111111111111111111","function":"find"},"op":"execute"},{"expect":{"match":"subset","result":{"branch":"feature/search","cseq":null}},"input":{"branch":"feature/search","cseq":null},"op":"index_lag"},{"expect":{"match":"subset","result":{"attempts":1,"metering":{"connector_calls":0,"instructions":{"search":1},"outcome":"ok","process_id":"00000000-0000-4000-8000-000000000004","units":42},"result":{"items":[{"class":"Invoice","field":"title","object_id":"01890a5d-ac96-700b-8000-00000000000b","score":[1,1],"snippet":"Quarterly <em>invoices</em> for consulting services"},{"class":"Invoice","field":"title","object_id":"01890a5d-ac96-700d-8000-00000000000d","score":[1,1],"snippet":"Hardware <em>invoice</em>"},{"class":"Invoice","field":"title","object_id":"01890a5d-ac96-7010-8000-000000000010","score":[1,1],"snippet":"Late <em>invoice</em>"}],"lagging":false,"watermark":{"cseq":2}}}},"input":{"args":["invoice",null,null],"asset":"acme.srch","branch":"feature/search","entropy_seed":"1111111111111111111111111111111111111111111111111111111111111111","function":"find"},"op":"execute"}]}
