{"clauses":["STD-VER-060"],"description":"a tag name is not reused","id":"VER-CONF-1566","polarity":"negative","profile":"Core","setup":[{"input":{"now":"2026-03-15T10:00:00.000000Z"},"op":"set_now"},{"input":{"classes":[{"description":"Customer","fields":[{"description":"name","label":"name","name":"name","required":true,"type":"text"},{"description":"email","label":"email","name":"email","type":"text"},{"description":"credit_limit","label":"credit limit","name":"credit_limit","type":"money"},{"default":"US","description":"country","label":"country","name":"country","type":"text"}],"kind":"definition","label":"Customer","name":"Customer","namespace":"acme.finance","parent":"DataObject","schema_version":1},{"description":"FiscalPeriod","fields":[{"description":"start","label":"start","name":"start","required":true,"type":"date"},{"description":"end","label":"end","name":"end","required":true,"type":"date"},{"constraints":{"allowed_values":["open","closing","closed"]},"description":"state","label":"state","name":"state","required":true,"type":"enum"}],"kind":"definition","label":"FiscalPeriod","name":"FiscalPeriod","namespace":"acme.finance","parent":"DataObject","schema_version":1},{"description":"GlEntry","fields":[{"description":"account","label":"account","name":"account","required":true,"type":"text"},{"description":"amount","label":"amount","name":"amount","required":true,"type":"money"},{"description":"memo","label":"memo","name":"memo","type":"text"}],"kind":"ledger","label":"GlEntry","ledger":{"amounts":["amount"],"double_entry":true,"key":["account"],"period_scope":"FiscalPeriod"},"name":"GlEntry","namespace":"acme.finance","parent":"DataObject","schema_version":1},{"description":"StockMove","fields":[{"description":"item","label":"item","name":"item","required":true,"type":"text"},{"description":"quantity","label":"quantity","name":"quantity","required":true,"type":"decimal"}],"kind":"ledger","label":"StockMove","ledger":{"amounts":["quantity"],"double_entry":false,"key":["item"]},"name":"StockMove","namespace":"acme.finance","parent":"DataObject","schema_version":1},{"description":"ImportedDocument","fields":[{"description":"source","label":"source","name":"source","required":true,"type":"text"}],"kind":"raw_document","label":"ImportedDocument","name":"ImportedDocument","namespace":"acme.finance","parent":"DataObject","schema_version":1},{"description":"DeliveryJob","fields":[{"description":"target","label":"target","name":"target","type":"text"}],"kind":"system","label":"DeliveryJob","name":"DeliveryJob","namespace":"acme.finance","parent":"SystemObject","schema_version":1},{"description":"TaxRule","fields":[{"description":"rate","label":"rate","name":"rate","required":true,"type":"decimal"},{"description":"note","label":"note","name":"note","type":"text"}],"kind":"definition","label":"TaxRule","name":"TaxRule","namespace":"acme.finance","parent":"ConfigAsset","schema_version":1},{"description":"BudgetLine","fields":[{"description":"account","label":"account","name":"account","required":true,"type":"text"},{"description":"amount","label":"amount","name":"amount","required":true,"type":"decimal"}],"kind":"ledger","label":"BudgetLine","ledger":{"amounts":["amount"],"double_entry":false,"key":["account"]},"name":"BudgetLine","namespace":"acme.finance","parent":"DataObject","schema_version":1,"write_policy":"change_set"},{"description":"PriceList","emit_became_effective":true,"fields":[{"description":"price","label":"price","name":"price","required":true,"type":"decimal"}],"kind":"definition","label":"PriceList","name":"PriceList","namespace":"acme.finance","parent":"DataObject","schema_version":1}]},"op":"load_genesis"}],"steps":[{"expect":{"match":"subset","result":{"cseq":1,"entries":{},"retroactive":[]}},"input":{"branch":"main","changes":[{"body":{"name":"Acme"},"class":"Customer","object_id":"01890a5d-ac96-7001-8000-000000000001","op":"create","slug":"c-1"}]},"op":"commit"},{"expect":{"match":"subset","result":{"branch":"main","cseq":1,"name":"q1-close"}},"input":{"branch":"main","name":"q1-close"},"op":"tag"},{"expect":{"match":"subset","result":{"cseq":2,"entries":{},"retroactive":[]}},"input":{"branch":"main","changes":[{"body":{"name":"Beta"},"class":"Customer","object_id":"01890a5d-ac96-7002-8000-000000000002","op":"create","slug":"c-2"}]},"op":"commit"},{"expect":{"error_code":"VER.TAG_IMMUTABLE"},"input":{"branch":"main","name":"q1-close"},"op":"tag"}]}
