{"clauses":["STD-LGS-052"],"description":"a query may not filter on a field masked for the viewer","id":"VER-CONF-5361","polarity":"positive","profile":"Governance","setup":[{"input":{"now":"2026-03-15T10:00:00.000000Z"},"op":"set_now"},{"input":{"classes":[{"description":"Person","fields":[{"description":"name","label":"name","name":"name","required":true,"type":"text"},{"description":"did","label":"did","name":"did","type":"text"},{"classification":"personal","description":"tax_id","label":"tax id","name":"tax_id","type":"text"},{"classification":"personal","description":"email","label":"email","name":"email","type":"text"},{"classification":"confidential","description":"salary","label":"salary","name":"salary","type":"decimal"},{"description":"region","label":"region","name":"region","type":"text"},{"authz_relation":"manager","constraints":{"target_class":"Person"},"description":"manager","label":"manager","name":"manager","type":"reference"}],"kind":"definition","label":"Person","name":"Person","namespace":"acme.finance","parent":"DataObject","principal_field":"did","schema_version":1,"subject_key":"self"},{"description":"Team","fields":[{"description":"name","label":"name","name":"name","required":true,"type":"text"},{"authz_relation":"member","constraints":{"item_type":{"constraints":{"target_class":"Person"},"type":"reference"}},"description":"members","label":"members","name":"members","type":"list"}],"kind":"definition","label":"Team","name":"Team","namespace":"acme.finance","parent":"DataObject","schema_version":1},{"description":"Agreement","fields":[{"description":"title","label":"title","name":"title","required":true,"type":"text"},{"description":"status","label":"status","name":"status","type":"text"},{"authz_relation":"owner","constraints":{"target_class":"Person"},"description":"owner","label":"owner","name":"owner","type":"reference"},{"authz_relation":"team","constraints":{"target_class":"Team"},"description":"team","label":"team","name":"team","type":"reference"},{"classification":"personal","description":"iban","label":"iban","name":"iban","type":"text"}],"kind":"definition","label":"Agreement","name":"Agreement","namespace":"acme.finance","parent":"DataObject","ports":[{"description":"sign","impl":"acme.agr#sign","kind":"command","name":"sign","params":[],"permission":"sign"}],"schema_version":1,"subject_key":"owner"},{"description":"Contact","fields":[{"description":"name","label":"name","name":"name","required":true,"type":"text"},{"classification":"personal","description":"phone","label":"phone","name":"phone","type":"text"}],"kind":"definition","label":"Contact","name":"Contact","namespace":"acme.finance","parent":"DataObject","schema_version":1}]},"op":"load_genesis"},{"input":{"from":"main","name":"feature/sec"},"op":"create_branch"},{"input":{"branch":"feature/sec","changes":[{"body":{"abi":"1.0","capabilities":["commit","read","run","emit"],"exports":["sign"],"name":"acme.agr","profile":"standard","source":{"functions":{"sign":{"body":[{"args":{"target":"self_id"},"do":"read.get"},{"args":{"set":{"status":"\"signed\""},"target":"self_id"},"do":"commit.update"},{"return":"\"signed\""}],"params":[]}}},"state":"committed","tier":"host"},"class":"Logic","object_id":"01890a5d-ac96-7050-8000-000000000050","op":"create","slug":"acme-agr"},{"body":{"did":"did:ubos:acme:01900000-0000-7000-8000-0000000000a2","name":"Bob","region":"east"},"class":"Person","object_id":"01890a5d-ac96-7002-8000-000000000002","op":"create","slug":"bob"},{"body":{"did":"did:ubos:acme:01900000-0000-7000-8000-0000000000a1","email":"alice@example.com","manager":"ubos://acme/Person/bob","name":"Alice","region":"east","salary":"5000","tax_id":"123-45-6789"},"class":"Person","object_id":"01890a5d-ac96-7001-8000-000000000001","op":"create","slug":"alice"},{"body":{"did":"did:ubos:acme:01900000-0000-7000-8000-0000000000a3","name":"Carol","region":"west"},"class":"Person","object_id":"01890a5d-ac96-7003-8000-000000000003","op":"create","slug":"carol"},{"body":{"did":"did:ubos:acme:01900000-0000-7000-8000-0000000000a4","name":"Dave","region":"west"},"class":"Person","object_id":"01890a5d-ac96-7004-8000-000000000004","op":"create","slug":"dave"},{"body":{"members":["ubos://acme/Person/dave"],"name":"Ops"},"class":"Team","object_id":"01890a5d-ac96-700a-8000-00000000000a","op":"create","slug":"ops"},{"body":{"iban":"DE89370400440532013000","owner":"ubos://acme/Person/alice","status":"draft","team":"ubos://acme/Team/ops","title":"Lease"},"class":"Agreement","object_id":"01890a5d-ac96-7014-8000-000000000014","op":"create","slug":"lease"}]},"label":"d","op":"commit"}],"steps":[{"expect":{"error_code":"QRY.INVALID_QUERY"},"input":{"as":{"principal":"did:ubos:acme:01900000-0000-7000-8000-0000000000a2"},"branch":"feature/sec","from":"Person","where":"this.tax_id == \"123-45-6789\""},"op":"query"},{"expect":{"match":"subset","result":{"objects":["01890a5d-ac96-7001-8000-000000000001","01890a5d-ac96-7002-8000-000000000002"]}},"input":{"as":{"principal":"did:ubos:acme:01900000-0000-7000-8000-0000000000a2"},"branch":"feature/sec","from":"Person","where":"this.region == \"east\""},"op":"query"}]}
