{"clauses":["STD-ISA-101"],"description":"an asset without the ask capability cannot ask","id":"VER-CONF-2894","polarity":"negative","profile":"Core","setup":[{"input":{"now":"2026-03-15T10:00:00.000000Z"},"op":"set_now"},{"input":{"classes":[{"description":"Party","fields":[{"description":"name","label":"name","name":"name","required":true,"type":"text"},{"default":"US","description":"country","label":"country","name":"country","type":"text"},{"constraints":{"allowed_values":["draft","active","closed"]},"description":"state","label":"state","name":"state","type":"enum"}],"kind":"definition","label":"Party","name":"Party","namespace":"acme.finance","parent":"DataObject","schema_version":1},{"description":"Customer","fields":[{"description":"email","label":"email","name":"email","type":"text"},{"description":"credit_limit","label":"credit limit","name":"credit_limit","type":"money"},{"description":"rating","label":"rating","name":"rating","type":"integer"}],"kind":"definition","label":"Customer","name":"Customer","namespace":"acme.finance","parent":"Party","schema_version":1,"validations":[{"message":"rating is 1 to 5","name":"rating_range","rule":"this.rating is null or (this.rating >= 1 and this.rating <= 5)","severity":"error"}]},{"description":"Account","fields":[{"description":"name","label":"name","name":"name","required":true,"type":"text"},{"description":"balance","label":"balance","name":"balance","type":"decimal"},{"description":"status","label":"status","name":"status","type":"text"}],"kind":"definition","label":"Account","name":"Account","namespace":"acme.finance","parent":"DataObject","ports":[{"description":"rename","impl":"acme.acct#rename","kind":"command","name":"rename","params":[{"description":"name","label":"name","name":"name","required":true,"type":"text"}],"permission":"rename"},{"description":"close","impl":"acme.acct#close","kind":"command","name":"close","params":[],"permission":"close"},{"description":"peek","impl":"acme.acct#peek","kind":"query","name":"peek","params":[],"permission":"peek"}],"schema_version":1},{"description":"CashMove","fields":[{"constraints":{"target_class":"Account"},"description":"account","label":"account","name":"account","type":"reference"},{"description":"amount","label":"amount","name":"amount","required":true,"type":"decimal"}],"kind":"ledger","label":"CashMove","ledger":{"amounts":["amount"],"double_entry":false,"key":["account"]},"name":"CashMove","namespace":"acme.finance","parent":"DataObject","schema_version":1},{"description":"Vault","fields":[{"description":"name","label":"name","name":"name","required":true,"type":"text"},{"description":"amount","label":"amount","name":"amount","type":"decimal"}],"kind":"definition","label":"Vault","name":"Vault","namespace":"acme.finance","parent":"DataObject","schema_version":1,"write_policy":"change_set"}]},"op":"load_genesis"},{"input":{"from":"main","name":"feature/rules"},"op":"create_branch"},{"input":{"did":"did:ubos:acme:01900000-0000-7000-8000-000000000031","roles":["clerk"]},"op":"principal"},{"input":{"did":"did:ubos:acme:01900000-0000-7000-8000-000000000032","roles":["clerk"]},"op":"principal"},{"input":{"did":"did:ubos:acme:01900000-0000-7000-8000-000000000033","roles":["clerk","senior"]},"op":"principal"},{"input":{"did":"did:ubos:acme:01900000-0000-7000-8000-000000000034","roles":["clerk"]},"op":"principal"},{"input":{"did":"did:ubos:acme:01900000-0000-7000-8000-000000000035","roles":["ap_lead"]},"op":"principal"},{"input":{"did":"did:ubos:acme:01900000-0000-7000-8000-000000000021","roles":["controller"]},"op":"principal"},{"input":{"did":"did:ubos:acme:01900000-0000-7000-8000-000000000022","roles":[]},"op":"principal"},{"input":{"did":"did:ubos:acme:01900000-0000-7000-8000-000000000020","roles":["clerk"]},"op":"principal"}],"steps":[{"expect":{"match":"subset","result":{"cseq":1,"entries":{},"retroactive":[]}},"input":{"branch":"feature/rules","changes":[{"body":{"abi":"1.0","capabilities":["commit","read","run","emit"],"exports":["rename","close","peek"],"name":"acme.acct","profile":"standard","source":{"functions":{"close":{"body":[{"args":{"target":"self_id"},"do":"read.get"},{"args":{"set":{"status":"\"closed\""},"target":"self_id"},"do":"commit.update"},{"return":"\"closed\""}],"params":[]},"peek":{"body":[{"args":{"target":"self_id"},"as":"o","do":"read.get"},{"return":"o.fields.status"}],"params":[]},"rename":{"body":[{"args":{"target":"self_id"},"do":"read.get"},{"args":{"set":{"name":"params.name"},"target":"self_id"},"do":"commit.update"},{"return":"params.name"}],"params":["name"]}}},"state":"committed","tier":"host"},"class":"Logic","object_id":"01890a5d-ac96-7050-8000-000000000050","op":"create","slug":"acme-acct"},{"body":{"balance":"100","name":"Acme","status":"open"},"class":"Account","object_id":"01890a5d-ac96-7001-8000-000000000001","op":"create","slug":"a-1"},{"body":{"abi":"1.0","capabilities":["commit","read","run","emit","ask"],"exports":["open","two","later","writes","bad"],"name":"acme.ask","profile":"standard","source":{"functions":{"bad":{"body":[{"args":{"fields":[{"name":"\"account\""}],"message":"\"Which account?\"","request":"\"account\""},"as":"account","do":"ask.input"},{"return":"1"}],"params":[]},"later":{"body":[{"args":{"fields":[{"name":"\"account\"","required":"true","type":"\"text\""}],"message":"\"Which account?\"","request":"\"account\"","timeout":"\"PT1H\""},"as":"account","do":"ask.input"},{"return":"account.account"}],"params":[]},"open":{"body":[{"args":{"fields":[{"name":"\"account\"","required":"true","type":"\"text\""},{"name":"\"note\"","required":"false","type":"\"text\""}],"message":"\"Which account?\"","request":"\"account\""},"as":"account","do":"ask.input"},{"args":{"class":"\"Party\"","fields":{"name":"account.account"}},"do":"commit.create"},{"return":"account.account"}],"params":[]},"two":{"body":[{"args":{"fields":[{"name":"\"account\"","required":"true","type":"\"text\""}],"message":"\"Which account?\"","request":"\"account\""},"as":"account","do":"ask.input"},{"args":{"fields":[{"name":"\"count\"","required":"true","type":"\"integer\""}],"message":"\"How many?\"","request":"\"count\""},"as":"count","do":"ask.input"},{"args":{"class":"\"Party\"","fields":{"name":"account.account"}},"do":"commit.create"},{"return":"count.count"}],"params":[]},"writes":{"body":[{"args":{"class":"\"Party\"","fields":{"name":"\"draft\""}},"do":"commit.create"},{"args":{"fields":[{"name":"\"account\"","required":"true","type":"\"text\""}],"message":"\"Which account?\"","request":"\"account\""},"as":"account","do":"ask.input"},{"return":"account.account"}],"params":[]}}},"state":"committed","tier":"host"},"class":"Logic","object_id":"01890a5d-ac96-72da-8000-0000000002da","op":"create","slug":"acme-ask"},{"body":{"abi":"1.0","capabilities":["commit","read","run","emit"],"exports":["open"],"name":"acme.noask","profile":"standard","source":{"functions":{"open":{"body":[{"args":{"fields":[{"name":"\"account\"","required":"true","type":"\"text\""}],"message":"\"Which account?\"","request":"\"account\""},"as":"account","do":"ask.input"},{"return":"1"}],"params":[]}}},"state":"committed","tier":"host"},"class":"Logic","object_id":"01890a5d-ac96-72db-8000-0000000002db","op":"create","slug":"acme-noask"}]},"label":"d","op":"commit"},{"expect":{"error_code":"LOGIC.FORBIDDEN_CAPABILITY"},"input":{"args":[],"asset":"acme.noask","branch":"feature/rules","entropy_seed":"1111111111111111111111111111111111111111111111111111111111111111","function":"open"},"op":"execute"}]}
