{"clauses":["STD-KIND-024"],"description":"a balanced posting group commits","id":"VER-CONF-1085","polarity":"positive","profile":"Ledger","setup":[{"input":{"now":"2026-03-15T10:00:00.000000Z"},"op":"set_now"},{"input":{"classes":[{"description":"Customer","fields":[{"description":"name","label":"name","name":"name","required":true,"type":"text"},{"description":"email","label":"email","name":"email","type":"text"},{"description":"credit_limit","label":"credit limit","name":"credit_limit","type":"money"},{"default":"US","description":"country","label":"country","name":"country","type":"text"}],"kind":"definition","label":"Customer","name":"Customer","namespace":"acme.finance","parent":"DataObject","schema_version":1},{"description":"FiscalPeriod","fields":[{"description":"start","label":"start","name":"start","required":true,"type":"date"},{"description":"end","label":"end","name":"end","required":true,"type":"date"},{"constraints":{"allowed_values":["open","closing","closed"]},"description":"state","label":"state","name":"state","required":true,"type":"enum"}],"kind":"definition","label":"FiscalPeriod","name":"FiscalPeriod","namespace":"acme.finance","parent":"DataObject","schema_version":1},{"description":"GlEntry","fields":[{"description":"account","label":"account","name":"account","required":true,"type":"text"},{"description":"amount","label":"amount","name":"amount","required":true,"type":"money"},{"description":"memo","label":"memo","name":"memo","type":"text"}],"kind":"ledger","label":"GlEntry","ledger":{"amounts":["amount"],"double_entry":true,"key":["account"],"period_scope":"FiscalPeriod"},"name":"GlEntry","namespace":"acme.finance","parent":"DataObject","schema_version":1},{"description":"StockMove","fields":[{"description":"item","label":"item","name":"item","required":true,"type":"text"},{"description":"quantity","label":"quantity","name":"quantity","required":true,"type":"decimal"}],"kind":"ledger","label":"StockMove","ledger":{"amounts":["quantity"],"double_entry":false,"key":["item"]},"name":"StockMove","namespace":"acme.finance","parent":"DataObject","schema_version":1},{"description":"ImportedDocument","fields":[{"description":"source","label":"source","name":"source","required":true,"type":"text"}],"kind":"raw_document","label":"ImportedDocument","name":"ImportedDocument","namespace":"acme.finance","parent":"DataObject","schema_version":1},{"description":"DeliveryJob","fields":[{"description":"target","label":"target","name":"target","type":"text"}],"kind":"system","label":"DeliveryJob","name":"DeliveryJob","namespace":"acme.finance","parent":"SystemObject","schema_version":1}]},"op":"load_genesis"}],"steps":[{"expect":{"match":"subset","result":{"cseq":1,"entries":{"01890a5d-ac96-700a-8000-00000000000a":{"seq":1},"01890a5d-ac96-700b-8000-00000000000b":{"seq":1}}}},"input":{"branch":"main","changes":[{"body":{"account":"1010","amount":{"amount":"100.00","currency":"USD"}},"class":"GlEntry","entry_id":"01890a5d-ac96-700a-8000-00000000000a","ledger_key":{"account":"1010"},"op":"append","posting_group":"g1","valid_at":"2026-03-15"},{"body":{"account":"4000","amount":{"amount":"-100.00","currency":"USD"}},"class":"GlEntry","entry_id":"01890a5d-ac96-700b-8000-00000000000b","ledger_key":{"account":"4000"},"op":"append","posting_group":"g1","valid_at":"2026-03-15"}]},"op":"commit"},{"expect":{"match":"subset","result":{"entries":[{"body":{"account":"4000","amount":{"amount":"-100.00","currency":"USD"}},"entry_id":"01890a5d-ac96-700b-8000-00000000000b","seq":1,"valid_at":"2026-03-15"}]}},"input":{"branch":"main","class":"GlEntry","ledger_key":{"account":"4000"}},"op":"read_ledger"}],"tags":["prototype"]}
