{"clauses":["STD-CLS-003"],"description":"two ports of one class need different names","id":"VER-CONF-0579","polarity":"negative","profile":"Core","setup":[],"steps":[{"expect":{"error_code":"MODEL.DECLARATION_INCOMPLETE"},"input":{"class":"Account","classes":[{"description":"Account","fields":[{"description":"name","label":"name","name":"name","required":true,"type":"text"}],"kind":"definition","label":"Account","name":"Account","namespace":"acme.finance","parent":"DataObject","ports":[{"description":"a","kind":"command","name":"a","params":[],"permission":"a"},{"description":"a","kind":"command","name":"a","params":[],"permission":"a"}],"schema_version":1}]},"op":"effective_class"}]}
