{"clauses":["STD-CLS-040"],"description":"a to-one cardinality on a list field is rejected","id":"VER-CONF-0811","polarity":"negative","profile":"Core","setup":[],"steps":[{"expect":{"error_code":"MODEL.INVALID_VALUE"},"input":{"class":"X","classes":[{"description":"Customer","fields":[{"description":"name","label":"name","name":"name","required":true,"type":"text"}],"kind":"definition","label":"Customer","name":"Customer","namespace":"acme.finance","parent":"DataObject","schema_version":1},{"description":"X","fields":[{"constraints":{"item_type":{"constraints":{"target_class":"Customer"},"type":"reference"}},"description":"c","label":"c","name":"c","relationship":{"cardinality":"many_to_one","target":"Customer"},"type":"list"}],"kind":"definition","label":"X","name":"X","namespace":"acme.finance","parent":"DataObject","schema_version":1}]},"op":"effective_class"}]}
