{"clauses":["STD-FND-026"],"description":"the constraints of the base type apply after normalisation","id":"VER-CONF-0262","polarity":"negative","profile":"Core","setup":[],"steps":[{"expect":{"error_code":"MODEL.CONSTRAINT_VIOLATED"},"input":{"type":"Isin","value":"US03783310050","value_types":[{"base":"text","constraints":{"max_length":12,"min_length":12},"description":"ISO 6166 security identifier","name":"Isin","normalize":"upper(trim(value))","validate":"isin_valid(value)"}]},"op":"validate_value"}]}
