{"clauses":["STD-PROTO-011"],"description":"read returns the object the URI names","id":"VER-CONF-5470","polarity":"positive","profile":"Protocol","setup":[{"input":{"now":"2026-03-15T10:00:00.000000Z"},"op":"set_now"},{"input":{"classes":[{"description":"Party","fields":[{"description":"name","label":"name","name":"name","required":true,"type":"text"},{"default":"US","description":"country","label":"country","name":"country","type":"text"},{"constraints":{"allowed_values":["draft","active","closed"]},"description":"state","label":"state","name":"state","type":"enum"}],"kind":"definition","label":"Party","name":"Party","namespace":"acme.finance","parent":"DataObject","schema_version":1},{"description":"Customer","fields":[{"description":"email","label":"email","name":"email","type":"text"},{"description":"credit_limit","label":"credit limit","name":"credit_limit","type":"money"},{"description":"rating","label":"rating","name":"rating","type":"integer"}],"kind":"definition","label":"Customer","name":"Customer","namespace":"acme.finance","parent":"Party","schema_version":1,"validations":[{"message":"rating is 1 to 5","name":"rating_range","rule":"this.rating is null or (this.rating >= 1 and this.rating <= 5)","severity":"error"}]},{"description":"Account","fields":[{"description":"name","label":"name","name":"name","required":true,"type":"text"},{"description":"balance","label":"balance","name":"balance","type":"decimal"},{"description":"status","label":"status","name":"status","type":"text"}],"kind":"definition","label":"Account","name":"Account","namespace":"acme.finance","parent":"DataObject","ports":[{"description":"rename","impl":"acme.acct#rename","kind":"command","name":"rename","params":[{"description":"name","label":"name","name":"name","required":true,"type":"text"}],"permission":"rename"},{"description":"close","impl":"acme.acct#close","kind":"command","name":"close","params":[],"permission":"close"},{"description":"peek","impl":"acme.acct#peek","kind":"query","name":"peek","params":[],"permission":"peek"}],"schema_version":1},{"description":"CashMove","fields":[{"constraints":{"target_class":"Account"},"description":"account","label":"account","name":"account","type":"reference"},{"description":"amount","label":"amount","name":"amount","required":true,"type":"decimal"}],"kind":"ledger","label":"CashMove","ledger":{"amounts":["amount"],"double_entry":false,"key":["account"]},"name":"CashMove","namespace":"acme.finance","parent":"DataObject","schema_version":1},{"description":"Vault","fields":[{"description":"name","label":"name","name":"name","required":true,"type":"text"},{"description":"amount","label":"amount","name":"amount","type":"decimal"}],"kind":"definition","label":"Vault","name":"Vault","namespace":"acme.finance","parent":"DataObject","schema_version":1,"write_policy":"change_set"}]},"op":"load_genesis"},{"input":{"from":"main","name":"feature/api"},"op":"create_branch"}],"steps":[{"expect":{"match":"subset","result":{"cseq":1,"entries":{},"retroactive":[]}},"input":{"branch":"feature/api","changes":[{"body":{"country":"US","name":"Acme","rating":3},"class":"Customer","object_id":"01890a5d-ac96-7001-8000-000000000001","op":"create","slug":"acme"}]},"op":"commit"},{"expect":{"match":"subset","result":{"responses":[{"body":{"abi":"1.0","encoding":"json","features":[],"limits":{"frame_bytes":16777216,"retention":100,"window":8},"principal":{"authority":"acme","did":"did:ubos:acme:01900000-0000-7000-8000-000000000002","kind":"human"},"session_id":"s1","version":"1.0"},"id":"s1","reply_to":"h","type":"result","v":"1.0"},{"body":{"items":[{"body":{"country":"US","name":"Acme","rating":3},"branch":"feature/api","canonical":"ubos://acme/Customer/acme","class":"Customer","object_id":"01890a5d-ac96-7001-8000-000000000001","redirected":false,"slug":"acme","valid":{"from":"2026-03-15","to":null}}]},"id":"s2","reply_to":"1","type":"result","v":"1.0"}]}},"input":{"messages":[{"body":{"abi":{"max":"1.0","min":"1.0"},"credentials":{"kind":"in_process"},"encodings":["json"],"features":[],"versions":["1.0"]},"id":"h","type":"handshake","v":"1.0"},{"body":{"branch":"feature/api","read":"ubos://acme/Customer/acme","vae":"acme"},"id":"1","type":"query","v":"1.0"}]},"op":"ubtp"}]}
