{"clauses":["STD-FND-024"],"description":"a repeated local time in Berlin resolves to the earlier instant","determinism":{"tzdb":"2025b"},"id":"VER-CONF-0225","polarity":"positive","profile":"Core","setup":[],"steps":[{"expect":{"match":"exact","result":"2024-10-27T00:30:00.000000Z"},"input":{"date":"2024-10-27","time":"02:30:00","tz":"Europe/Berlin"},"op":"local_to_instant"}],"tags":["prototype"]}
