{"clauses":["STD-CLS-001"],"description":"a class declaration without fields is incomplete","id":"VER-CONF-0508","polarity":"negative","profile":"Core","setup":[],"steps":[{"expect":{"error_code":"MODEL.DECLARATION_INCOMPLETE"},"input":{"class":"Account","classes":[{"description":"Account","kind":"definition","label":"Account","name":"Account","namespace":"acme.finance","parent":"DataObject","schema_version":1}]},"op":"effective_class"}]}
