{"clauses":["STD-LGS-001"],"description":"a selector list applies the block to every selector","id":"VER-CONF-4810","polarity":"positive","profile":"Governance","setup":[],"steps":[{"expect":{"match":"exact","result":{"ast":{"blocks":[{"declarations":[{"property":"audit_level","value":"standard"}],"selectors":[{"type":"Customer"},{"type":"Supplier"}]}]},"source":"Customer, Supplier {\n  audit_level: \"standard\";\n}\n"}},"input":{"source":"Customer, Supplier { audit_level: \"standard\"; }"},"op":"parse_sheet"}]}
