{"clauses":["STD-PROTO-021"],"description":"GET of a class with q maps to a query","id":"VER-CONF-5582","polarity":"positive","profile":"Protocol","setup":[{"input":{"now":"2026-03-15T10:00:00.000000Z"},"op":"set_now"},{"input":{"classes":[{"description":"Person","fields":[{"description":"name","label":"name","name":"name","required":true,"type":"text"},{"description":"did","label":"did","name":"did","type":"text"}],"kind":"definition","label":"Person","name":"Person","namespace":"acme.finance","parent":"DataObject","principal_field":"did","schema_version":1},{"description":"Customer","fields":[{"description":"name","label":"name","name":"name","required":true,"type":"text"},{"description":"balance","label":"balance","name":"balance","type":"decimal"},{"classification":"personal","description":"tax_id","label":"tax id","name":"tax_id","type":"text"},{"authz_relation":"owner","constraints":{"target_class":"Person"},"description":"owner","label":"owner","name":"owner","type":"reference"}],"kind":"definition","label":"Customer","name":"Customer","namespace":"acme.finance","parent":"DataObject","ports":[{"description":"touch","impl":"acme.int#touch","kind":"command","name":"touch","params":[],"permission":"touch"}],"schema_version":1}]},"op":"load_genesis"},{"input":{"from":"main","name":"feature/int"},"op":"create_branch"},{"input":{"hosts":["bank.example"]},"op":"egress_allow"},{"input":{"branch":"feature/int","changes":[{"body":{"did":"did:ubos:acme:01900000-0000-7000-8000-0000000000a1","name":"Alice"},"class":"Person","object_id":"01890a5d-ac96-7002-8000-000000000002","op":"create","slug":"alice"},{"body":{"balance":"100","name":"Acme","owner":"ubos://acme/Person/alice","tax_id":"123-45-6789"},"class":"Customer","object_id":"01890a5d-ac96-7001-8000-000000000001","op":"create","slug":"c-1"},{"body":{"balance":"20","name":"Globex"},"class":"Customer","object_id":"01890a5d-ac96-7003-8000-000000000003","op":"create","slug":"c-2"},{"body":{"body":"Tax ID {{this.tax_id}}, balance {{this.balance}}","description":"update","name":"acme.update","title":"Update for {{this.name}}"},"class":"NotificationTemplate","object_id":"01890a5d-ac96-7046-8000-000000000046","op":"create","slug":"update"},{"body":{"abi":"1.0","capabilities":["commit","read","run","emit","call","connector:ubos://acme/Connector/bank"],"exports":["reserve","reserve_fail","reserve_twice_fail","check_fail","check","personal","unknown_op","bad_request","pay_later","pay_now","notify","notify_fail","notify_bad","notify_unknown","touch"],"name":"acme.int","profile":"standard","source":{"functions":{"bad_request":{"body":[{"args":{"connector":"\"ubos://acme/Connector/bank\"","operation":"\"reserve\"","request":{"account":"\"a-1\"","amount":"\"ten\""},"when":"\"now\""},"do":"call.connector"}],"params":[]},"check":{"body":[{"args":{"connector":"\"ubos://acme/Connector/bank\"","operation":"\"check\"","request":{"account":"\"a-1\""},"when":"\"now\""},"as":"r","do":"call.connector"},{"return":"r.status"}],"params":[]},"check_fail":{"body":[{"args":{"connector":"\"ubos://acme/Connector/bank\"","operation":"\"check\"","request":{"account":"\"a-1\""},"when":"\"now\""},"do":"call.connector"},{"fail":"RULE.INVARIANT_VIOLATED"}],"params":[]},"notify":{"body":[{"args":{"action":"\"touch\"","channels":["\"in_app\"","\"email\""],"priority":"\"high\"","recipients":["\"did:ubos:acme:01900000-0000-7000-8000-0000000000a1\"","\"role:support\"","\"relation:owner\""],"subject":"\"ubos://acme/Customer/c-1\"","template":"\"ubos://acme/NotificationTemplate/update\""},"do":"emit.notify"}],"params":[]},"notify_bad":{"body":[{"args":{"recipients":["\"bob\""],"subject":"\"ubos://acme/Customer/c-1\"","template":"\"ubos://acme/NotificationTemplate/update\""},"do":"emit.notify"}],"params":[]},"notify_fail":{"body":[{"args":{"recipients":["\"did:ubos:acme:01900000-0000-7000-8000-0000000000a1\""],"subject":"\"ubos://acme/Customer/c-1\"","template":"\"ubos://acme/NotificationTemplate/update\""},"do":"emit.notify"},{"fail":"RULE.INVARIANT_VIOLATED"}],"params":[]},"notify_unknown":{"body":[{"args":{"recipients":["\"did:ubos:acme:01900000-0000-7000-8000-0000000000a1\""],"subject":"\"ubos://acme/Customer/c-1\"","template":"\"ubos://acme/NotificationTemplate/none\""},"do":"emit.notify"}],"params":[]},"pay_later":{"body":[{"args":{"connector":"\"ubos://acme/Connector/bank\"","operation":"\"pay\"","request":{"account":"\"a-1\"","amount":"\"10.50\""},"when":"\"after_commit\""},"as":"e","do":"call.connector"},{"return":"e.effect_id"}],"params":[]},"pay_now":{"body":[{"args":{"connector":"\"ubos://acme/Connector/bank\"","operation":"\"pay\"","request":{"account":"\"a-1\"","amount":"\"10.50\""},"when":"\"now\""},"do":"call.connector"}],"params":[]},"personal":{"body":[{"args":{"connector":"\"ubos://acme/Connector/bank\"","operation":"\"reserve\"","request":{"account":"\"a-1\"","amount":"\"10.50\"","tax_id":"\"123-45-6789\""},"when":"\"now\""},"do":"call.connector"}],"params":[]},"reserve":{"body":[{"args":{"connector":"\"ubos://acme/Connector/bank\"","operation":"\"reserve\"","request":{"account":"\"a-1\"","amount":"\"10.50\""},"when":"\"now\""},"as":"r","do":"call.connector"},{"return":"r.reservation"}],"params":[]},"reserve_fail":{"body":[{"args":{"connector":"\"ubos://acme/Connector/bank\"","operation":"\"reserve\"","request":{"account":"\"a-1\"","amount":"\"10.50\""},"when":"\"now\""},"do":"call.connector"},{"fail":"RULE.INVARIANT_VIOLATED"}],"params":[]},"reserve_twice_fail":{"body":[{"args":{"connector":"\"ubos://acme/Connector/bank\"","operation":"\"reserve\"","request":{"account":"\"a-1\"","amount":"\"10.50\""},"when":"\"now\""},"do":"call.connector"},{"args":{"connector":"\"ubos://acme/Connector/bank\"","operation":"\"reserve\"","request":{"account":"\"a-2\"","amount":"\"5.00\""},"when":"\"now\""},"do":"call.connector"},{"fail":"RULE.INVARIANT_VIOLATED"}],"params":[]},"touch":{"body":[{"return":"\"touched\""}],"params":[]},"unknown_op":{"body":[{"args":{"connector":"\"ubos://acme/Connector/bank\"","operation":"\"refund\"","request":{"account":"\"a-1\"","amount":"\"10.50\""},"when":"\"now\""},"do":"call.connector"}],"params":[]}}},"state":"committed","tier":"host"},"class":"Logic","object_id":"01890a5d-ac96-7050-8000-000000000050","op":"create","slug":"acme-int"},{"body":{"abi":"1.0","capabilities":["call"],"exports":["reserve"],"name":"acme.plain","profile":"standard","source":{"functions":{"reserve":{"body":[{"args":{"connector":"\"ubos://acme/Connector/bank\"","operation":"\"reserve\"","request":{"account":"\"a-1\"","amount":"\"10.50\""},"when":"\"now\""},"as":"r","do":"call.connector"},{"return":"r.reservation"}],"params":[]}}},"state":"committed","tier":"host"},"class":"Logic","object_id":"01890a5d-ac96-7051-8000-000000000051","op":"create","slug":"acme-plain"},{"body":{"allowed_classifications":["public","internal"],"auth":{"credential":"secret://bank/api","method":"oauth2"},"breaker":{"failures":3,"open_for":"PT1M"},"description":"bank","endpoint":{"host":"bank.example","path":"/api","protocol":"https"},"name":"bank","operations":{"check":{"compensation":"none","compensation_reason":"a read changes nothing","now":true,"request":[{"name":"account","required":true,"type":"text"}],"response":[{"name":"status","required":true,"type":"text"}]},"pay":{"request":[{"name":"account","required":true,"type":"text"},{"name":"amount","required":true,"type":"decimal"}],"response":[{"name":"payment_id","type":"text"}]},"release":{"request":[{"name":"account","type":"text"},{"name":"amount","type":"decimal"},{"name":"tax_id","type":"text"}],"response":[]},"reserve":{"compensation":"release","now":true,"redact":["token"],"request":[{"name":"account","required":true,"type":"text"},{"name":"amount","required":true,"type":"decimal"},{"classification":"personal","name":"tax_id","type":"text"}],"response":[{"name":"reservation","required":true,"type":"text"},{"name":"token","type":"text"}]}},"rate_limit":{"count":3,"per":"minute"},"retry":{"max_attempts":2}},"class":"Connector","object_id":"01890a5d-ac96-703c-8000-00000000003c","op":"create","slug":"bank"}]},"label":"d","op":"commit"}],"steps":[{"expect":{"match":"subset","result":{"body":{"items":[{"body":{"balance":"100","name":"Acme","owner":"ubos://acme/Person/alice","tax_id":"123-45-6789"},"class":"Customer","object_id":"01890a5d-ac96-7001-8000-000000000001","slug":"c-1","valid":{"from":"2026-03-15","to":null}}]},"headers":{"Content-Type":"application/json"},"status":200}},"input":{"method":"GET","path":"/api/v1/acme/Customer","principal":"did:ubos:acme:01900000-0000-7000-8000-0000000000a1","query":{"branch":"feature/int","q":"this.balance > 50"}},"op":"rest"}]}
